{"contract":"graphforge-resolved-config/1","project":{"exports":".graphforge/exports","imports":".graphforge/imports","integration_root":".graphforge","migrations":".graphforge/migrations","ontology":".graphforge/ontology","schemas":".graphforge/schemas","seeds":".graphforge/seeds","state":".graphforge/state"},"secrets":[{"id":"service-token","source":"secret_manager"}],"sources":[{"id":"example-data","media_type":"application/vnd.apache.parquet","sha256":"aaaaaaaaaaaaaaaaaaaaaaaaaaaaaaaaaaaaaaaaaaaaaaaaaaaaaaaaaaaaaaaa","uri":"https://example.invalid/graphforge/example.parquet"}],"targets":[{"artifact":{"kind":"python_wheel","sha256":"bbbbbbbbbbbbbbbbbbbbbbbbbbbbbbbbbbbbbbbbbbbbbbbbbbbbbbbbbbbbbbbb","version":"0.5.0"},"backup":{"checkpoints":false},"health":{"timeout_seconds":30},"id":"local","kind":"embedded","network":{"exposure":"none","tls_required":false},"observability":{"logs":true,"metrics":false,"traces":false},"resources":{},"secret_ids":[],"source_ids":["example-data"],"storage":{"kind":"local","persistent":true},"write":{"mode":"single_writer"}},{"artifact":{"kind":"oci_image","sha256":"cccccccccccccccccccccccccccccccccccccccccccccccccccccccccccccccc","version":"0.5.1"},"backup":{"checkpoints":true,"retention_count":14},"health":{"timeout_seconds":30},"id":"production","kind":"service","network":{"exposure":"private","port":8443,"tls_required":true},"observability":{"logs":true,"metrics":true,"traces":false},"resources":{"cpu_millis":1000,"memory_bytes":2147483648},"secret_ids":["service-token"],"source_ids":["example-data"],"storage":{"capacity_bytes":10737418240,"kind":"volume","persistent":true},"write":{"mode":"queued_writer","queue_capacity":64}}]}
